type,store,name,price,image_url
semi-sweet chocolate chips,Target,Nestle Toll House Semi-Sweet Chocolate Chips for Baking - 12oz,$4.49,https://target.scene7.com/is/image/Target/GUEST_50dfedb1-7d08-4896-9b62-1703ea44832d?qlt=65&fmt=webp&hei=350&wid=350
semi-sweet chocolate chips,Target,Nestle Toll House Semi-Sweet Chocolate Mini Chocolate Chips for Baking- 10oz,$4.49,https://target.scene7.com/is/image/Target/GUEST_0254f3bf-ed0c-4104-b315-4c1bb52da66a?qlt=65&fmt=webp&hei=350&wid=350
semi-sweet chocolate chips,Target,Semi Sweet Chocolate Morsels - 12oz - Good & Gather™,$2.99,https://target.scene7.com/is/image/Target/GUEST_ece3f8a2-40fc-4d43-93cc-fdde20022fc6?qlt=65&fmt=webp&hei=350&wid=350
semi-sweet chocolate chips,Target,Nestle Toll House Semi-Sweet Chocolate Chips for Baking - 12oz,$4.49,https://target.scene7.com/is/image/Target/GUEST_50dfedb1-7d08-4896-9b62-1703ea44832d?qlt=65&fmt=webp&hei=350&wid=350
semi-sweet chocolate chips,Target,GHIRARDELLI Premium Baking Semi-Sweet Chocolate Chips - 12oz,$4.69,https://target.scene7.com/is/image/Target/GUEST_eff671f6-217d-44a2-8227-9c4a3195eda3?qlt=65&fmt=webp&hei=350&wid=350
semi-sweet chocolate chips,Target,Semi Sweet Mini Chocolate Morsels - 12oz - Good & Gather™,$2.99,https://target.scene7.com/is/image/Target/GUEST_8cd2d055-75c4-44bf-ae77-2a15dbcf3b3b?qlt=65&fmt=webp&hei=350&wid=350
semi-sweet chocolate chips,Target,Nestle Toll House Semi-Sweet Chocolate Chips for Baking - 24oz,$7.59,https://target.scene7.com/is/image/Target/GUEST_4b512806-c0a7-4436-a047-1cbbaaa575a2?qlt=65&fmt=webp&hei=350&wid=350
semi-sweet chocolate chips,Target,Nestle Toll House Dark Chocolate Chips for Baking- 10oz,$4.49,https://target.scene7.com/is/image/Target/GUEST_6e3e7e07-3ab5-4d70-a339-2d64aa0a0892?qlt=65&fmt=webp&hei=350&wid=350
semi-sweet chocolate chips,Target,Lily's Milk Style Chocolate Chips - 9oz,$7.49,N/A
